Seed Round - MOTI Physiotherapy,https://www.crunchbase.com/funding_round/moti-physiotherapy-seed--54f26af5,MOTI Physiotherapy,https://www.crunchbase.com/organization/moti-physiotherapy,Seed,400000,USD,400000,2017-10-09,"Health Care, Therapeutics","Los Angeles, California, United States, North America",Less than $1M,1,Seed
Series C - GitLab,https://www.crunchbase.com/funding_round/gitlab-com-series-c--d651d8ad,GitLab,https://www.crunchbase.com/organization/gitlab-com,Series C,22000000,USD,22000000,2017-10-09,"Information Technology, Open Source, Software","San Francisco, California, United States, North America",,8,Late Stage Venture
Seed Round - Finix,https://www.crunchbase.com/funding_round/finix-payments-seed--fc5205fe,Finix,https://www.crunchbase.com/organization/finix-payments,Seed,,,,2017-10-10,"Banking, E-Commerce, Financial Services, FinTech, Mobile, Payments","San Francisco, California, United States, North America",$1M to $10M,4,Early Stage Venture
Series G - Bill.com,https://www.crunchbase.com/funding_round/bill-com-series-g--2eec800d,Bill.com,https://www.crunchbase.com/organization/bill-com,Series G,82500000,USD,82500000,2017-10-10,"Apps, Billing, Financial Services, SaaS","Palo Alto, California, United States, North America",$10M to $50M,10,IPO
Convertible Note - Aumet,https://www.crunchbase.com/funding_round/aumet-convertible-note--e55581b8,Aumet,https://www.crunchbase.com/organization/aumet,Convertible Note,100000,USD,100000,2017-10-10,"Health Care, Hospital, Manufacturing, Medical","Mountain View, California, United States, North America",Less than $1M,4,Seed
Funding Round - Pickpocket,https://www.crunchbase.com/funding_round/pickpocket-undisclosed--7d176b80,Pickpocket,https://www.crunchbase.com/organization/pickpocket,Funding Round,286000,USD,286000,2017-10-10,"Consumer, Consumer Software, Financial Services, FinTech","San Francisco, California, United States, North America",,1,
Venture Round - Hippeas,https://www.crunchbase.com/funding_round/hippeas-series-unknown--8afa00ec,Hippeas,https://www.crunchbase.com/organization/hippeas,Venture - Series Unknown,10000000,USD,10000000,2017-10-10,"Food and Beverage, Health Care, Organic Food","Los Angeles, California, United States, North America",Less than $1M,4,
Series B - Clean Fund,https://www.crunchbase.com/funding_round/clean-fund-series-b--a80b2181,Clean Fund,https://www.crunchbase.com/organization/clean-fund,Series B,15000000,USD,15000000,2017-10-10,"Banking, Energy Efficiency, Financial Services, Renewable Energy","Sausalito, California, United States, North America",$1M to $10M,2,Early Stage Venture
Venture Round - Injectsense,https://www.crunchbase.com/funding_round/injectsense-series-unknown--2203e93b,Injectsense,https://www.crunchbase.com/organization/injectsense,Venture - Series Unknown,9836021,USD,9836021,2017-10-10,"Health Care, Medical Device","Emeryville, California, United States, North America",Less than $1M,1,
Seed Round - kegg,https://www.crunchbase.com/funding_round/lady-technologies-seed--7ff80758,kegg,https://www.crunchbase.com/organization/lady-technologies,Seed,,,,2017-10-10,"Fertility, Health Care, Medical Device, Personal Health","San Francisco, California, United States, North America",,3,Seed
Venture Round - GYFS,https://www.crunchbase.com/funding_round/gyfs-series-unknown--460aeebb,GYFS,https://www.crunchbase.com/organization/gyfs,Venture - Series Unknown,2499157,USD,2499157,2017-10-10,"Information Technology, Software","San Francisco, California, United States, North America",,1,
Seed Round - Visor,https://www.crunchbase.com/funding_round/visor-seed--9361f088,Visor,https://www.crunchbase.com/organization/visor,Seed,6500000,USD,6500000,2017-10-10,"Financial Services, FinTech","San Francisco, California, United States, North America",$1M to $10M,2,Early Stage Venture
Venture Round - The Door,https://www.crunchbase.com/funding_round/the-door-series-unknown--00c76a70,The Door,https://www.crunchbase.com/organization/the-door,Venture - Series Unknown,,,,2017-10-10,"Information Technology, Software","San Francisco, California, United States, North America",,1,M&A
Series C - Shockwave Medical,https://www.crunchbase.com/funding_round/shockwave-medical-series-c--67f7a915,Shockwave Medical,https://www.crunchbase.com/organization/shockwave-medical,Series C,35000000,USD,35000000,2017-10-10,"Health Care, Medical, Medical Device","Fremont, California, United States, North America",$10M to $50M,5,IPO
Series C - Carta,https://www.crunchbase.com/funding_round/eshares-series-c--762c7566,Carta,https://www.crunchbase.com/organization/eshares,Series C,42000000,USD,42000000,2017-10-11,"Finance, FinTech, Stock Exchanges","San Francisco, California, United States, North America",$10M to $50M,9,Late Stage Venture
Initial Coin Offering - Ripio,https://www.crunchbase.com/funding_round/bitpagos-initial-coin-offering--2433d13c,Ripio,https://www.crunchbase.com/organization/bitpagos,Initial Coin Offering,37000000,USD,37000000,2017-10-11,"Bitcoin, Finance, FinTech, Lending, Mobile Payments, Payments","San Francisco, California, United States, North America",$1M to $10M,10,
Series A - True Link Financial,https://www.crunchbase.com/funding_round/true-link-financial-series-a--320de764,True Link Financial,https://www.crunchbase.com/organization/true-link-financial,Series A,8000000,USD,8000000,2017-10-11,"Elderly, Finance, Fraud Detection","San Francisco, California, United States, North America",Less than $1M,5,Early Stage Venture
Series A - ShiftLeft,https://www.crunchbase.com/funding_round/shiftleft-series-a--0f3d37e4,ShiftLeft,https://www.crunchbase.com/organization/shiftleft,Series A,9300000,USD,9300000,2017-10-11,"Information Services, Information Technology, Security, Software","Santa Clara, California, United States, North America",$1M to $10M,2,Early Stage Venture
Seed Round - ForeSee Medical,https://www.crunchbase.com/funding_round/foresee-medical-seed--3eb399ee,ForeSee Medical,https://www.crunchbase.com/organization/foresee-medical,Seed,3000000,USD,3000000,2017-10-12,"Computer, Health Care, Software","San Diego, California, United States, North America",,3,
Series A - OmnyWay,https://www.crunchbase.com/funding_round/omnypay-series-a--c1f5b322,OmnyWay,https://www.crunchbase.com/organization/omnypay,Series A,12750000,USD,12750000,2017-10-12,"E-Commerce, Information Services, Information Technology, Payments, Retail","San Francisco, California, United States, North America",,3,Early Stage Venture
Seed Round - NumberAI,https://www.crunchbase.com/funding_round/numberai-seed--471c88b9,NumberAI,https://www.crunchbase.com/organization/numberai,Seed,1600000,USD,1600000,2017-10-12,"Artificial Intelligence, Information Services, Information Technology, Internet, Software","Oakland, California, United States, North America",$1M to $10M,3,
Debt Financing - IMT,https://www.crunchbase.com/funding_round/imt-debt-financing--5e0f020e,IMT,https://www.crunchbase.com/organization/imt,Debt Financing,,,,2017-10-13,"Information Technology, Innovation Management, Manufacturing, Medical, Optical Communication, Sensor","Santa Barbara, California, United States, North America",$10M to $50M,4,
Seed Round - Mission Labs,https://www.crunchbase.com/funding_round/mission-labs-d211-seed--25ba0967,Mission Labs,https://www.crunchbase.com/organization/mission-labs-d211,Seed,100000,USD,100000,2017-10-13,"Artificial Intelligence, Education, Information Technology, Machine Learning","San Francisco, California, United States, North America",,1,Seed
Venture Round - Clarify Medical,https://www.crunchbase.com/funding_round/clarify-medical-series-unknown--92445676,Clarify Medical,https://www.crunchbase.com/organization/clarify-medical,Venture - Series Unknown,,,,2017-10-13,"Health Care, Health Diagnostics, Medical, Medical Device, Therapeutics","La Jolla, California, United States, North America",Less than $1M,9,Early Stage Venture
Series A - Impact Biomedicines,https://www.crunchbase.com/funding_round/impact-biomedicines-series-a--0625849e,Impact Biomedicines,https://www.crunchbase.com/organization/impact-biomedicines,Series A,22000000,USD,22000000,2017-10-13,"Biotechnology, Health Care, Medical","San Diego, California, United States, North America",,2,M&A
Seed Round - Facegenics,https://www.crunchbase.com/funding_round/facegenics-seed--3cb791e8,Facegenics,https://www.crunchbase.com/organization/facegenics,Seed,1000000,USD,1000000,2017-10-15,"Dental, Health Care, Medical, Medical Device","Los Angeles, California, United States, North America",,2,Seed
Funding Round - MoData,https://www.crunchbase.com/funding_round/modata-undisclosed--67421a28,MoData,https://www.crunchbase.com/organization/modata,Funding Round,,,,2017-10-16,"Artificial Intelligence, Information Technology, Lead Management, SaaS, Software","Palo Alto, California, United States, North America",Less than $1M,1,
Venture Round - ModuleQ,https://www.crunchbase.com/funding_round/moduleq-series-unknown--15d5f4ad,ModuleQ,https://www.crunchbase.com/organization/moduleq,Venture - Series Unknown,3989808,USD,3989808,2017-10-16,"Artificial Intelligence, Enterprise Software, Information Technology","San Francisco, California, United States, North America",$1M to $10M,5,
Series A - PeproMene Bio,https://www.crunchbase.com/funding_round/pepromene-bio-series-a--24439c49,PeproMene Bio,https://www.crunchbase.com/organization/pepromene-bio,Series A,4000000,USD,4000000,2017-10-16,"Biotechnology, Health Care","Irvine, California, United States, North America",,1,Early Stage Venture
Angel Round - Botplan,https://www.crunchbase.com/funding_round/botplan-angel--b2f9306d,Botplan,https://www.crunchbase.com/organization/botplan,Angel,400000,USD,400000,2017-10-16,"Information Services, Information Technology, Internet, Real Estate","San Mateo, California, United States, North America",Less than $1M,1,Seed
Series C - Feedzai,https://www.crunchbase.com/funding_round/feedzai-series-c--3c950b7a,Feedzai,https://www.crunchbase.com/organization/feedzai,Series C,50000000,USD,50000000,2017-10-17,"Analytics, Artificial Intelligence, Big Data, Financial Services, FinTech, Fraud Detection, Information Technology, Risk Management","San Mateo, California, United States, North America",$10M to $50M,6,Late Stage Venture
Series B - Forty Seven,https://www.crunchbase.com/funding_round/forty-seven-series-b--5b13ffa9,Forty Seven,https://www.crunchbase.com/organization/forty-seven,Series B,75000000,USD,75000000,2017-10-17,"Biotechnology, Clinical Trials, Health Care","Palo Alto, California, United States, North America",$10M to $50M,3,M&A
Debt Financing - BlueVine,https://www.crunchbase.com/funding_round/bluevine-debt-financing--9157246f,BlueVine,https://www.crunchbase.com/organization/bluevine,Debt Financing,130000000,USD,130000000,2017-10-17,"Finance, Financial Services, FinTech, Small and Medium Businesses","Redwood City, California, United States, North America",$50M to $100M,13,Late Stage Venture
Equity Crowdfunding - ModiusHealth,https://www.crunchbase.com/funding_round/modiushealth-equity-crowdfunding--4d6fa3f9,ModiusHealth,https://www.crunchbase.com/organization/modiushealth,Equity Crowdfunding,1570000,USD,1570000,2017-10-17,"Health Care, Medical, Neuroscience","San Diego, California, United States, North America",,2,
Venture Round - Everactive,https://www.crunchbase.com/funding_round/everactive-series-unknown--bbe2051c,Everactive,https://www.crunchbase.com/organization/everactive,Venture - Series Unknown,10300000,USD,10300000,2017-10-17,"Cloud Data Services, Hardware, Information Technology, Internet of Things, Software, Wireless","Santa Clara, California, United States, North America",$1M to $10M,5,Early Stage Venture
Series C - LendingHome,https://www.crunchbase.com/funding_round/lendinghome-series-c--fa882ff5,LendingHome,https://www.crunchbase.com/organization/lendinghome,Series C,56600000,USD,56600000,2017-10-17,"Financial Services, Real Estate","San Francisco, California, United States, North America",$100M to $500M,5,Late Stage Venture
Series A - Bloomlife,https://www.crunchbase.com/funding_round/bloom-technologies-series-a--e2eaa5db,Bloomlife,https://www.crunchbase.com/organization/bloom-technologies,Series A,8114035,USD,8114035,2017-10-17,"Artificial Intelligence, Fitness, Health Care, mHealth, Wearables, Wellness","San Francisco, California, United States, North America",Less than $1M,5,Early Stage Venture
Venture Round - Mercury Technologies,https://www.crunchbase.com/funding_round/mercury-technologies-series-unknown--235b7cbc,Mercury Technologies,https://www.crunchbase.com/organization/mercury-technologies,Venture - Series Unknown,4925003,USD,4925003,2017-10-18,Information Technology,"San Francisco, California, United States, North America",,1,
Venture Round - PipelineRx,https://www.crunchbase.com/funding_round/pipelinerx-series-unknown--ddac8bd0,PipelineRx,https://www.crunchbase.com/organization/pipelinerx,Venture - Series Unknown,15373312,USD,15373312,2017-10-18,"Biotechnology, Health Care, Hospital","San Francisco, California, United States, North America",$1M to $10M,4,
Series C - BaseHealth,https://www.crunchbase.com/funding_round/basehealth-series-c--fd0562af,BaseHealth,https://www.crunchbase.com/organization/basehealth,Series C,8500000,USD,8500000,2017-10-18,"Artificial Intelligence, Health Care, Machine Learning, Medical, mHealth","Sunnyvale, California, United States, North America",,5,Late Stage Venture
Venture Round - Green Park Brands,https://www.crunchbase.com/funding_round/green-park-brands-series-unknown--29c65ed6,Green Park Brands,https://www.crunchbase.com/organization/green-park-brands,Venture - Series Unknown,9999972,USD,9999972,2017-10-18,"Fitness, Food and Beverage, Health Care, Lifestyle, Medical","Santa Monica, California, United States, North America",,2,
Seed Round - Interchange,https://www.crunchbase.com/funding_round/the-picks-shovels-co-seed--84fefc82,Interchange,https://www.crunchbase.com/organization/the-picks-shovels-co,Seed,,,,2017-10-18,"Cryptocurrency, Financial Services","San Francisco, California, United States, North America",,3,M&A
Seed Round - Aella Credit,https://www.crunchbase.com/funding_round/aella-credit-seed--3d713916,Aella Credit,https://www.crunchbase.com/organization/aella-credit,Seed,,,,2017-10-19,"Information Technology, Innovation Management, Social Impact","San Francisco, California, United States, North America",$1M to $10M,4,Seed
Seed Round - WeRecover,https://www.crunchbase.com/funding_round/werecover-seed--d65d6781,WeRecover,https://www.crunchbase.com/organization/werecover,Seed,3250000,USD,3250000,2017-10-19,"Fitness, Health Care, Hospitality, Mobile Apps, Online Portals, Rehabilitation, Search Engine, Travel, Wellness","Santa Monica, California, United States, North America",Less than $1M,4,Seed
Venture Round - McKay Brothers,https://www.crunchbase.com/funding_round/mckay-brothers-series-unknown--3f175727,McKay Brothers,https://www.crunchbase.com/organization/mckay-brothers,Venture - Series Unknown,,,,2017-10-19,"Financial Services, Professional Networking, Telecommunications, Wireless","Oakland, California, United States, North America",$1M to $10M,1,
Series A - EchoPixel,https://www.crunchbase.com/funding_round/echopixel-series-a--d69c5307,EchoPixel,https://www.crunchbase.com/organization/echopixel,Series A,8500000,USD,8500000,2017-10-19,"Biotechnology, Health Care, Medical","Los Altos Hills, California, United States, North America",$1M to $10M,6,Early Stage Venture
Seed Round - Amberdata,https://www.crunchbase.com/funding_round/amberdata-seed--90fabbda,Amberdata,https://www.crunchbase.com/organization/amberdata,Seed,2000000,USD,2000000,2017-10-19,"Blockchain, Cryptocurrency, Developer APIs, Developer Platform, FinTech","Palo Alto, California, United States, North America",Less than $1M,2,Seed
Venture Round - Manifold Technology,https://www.crunchbase.com/funding_round/manifold-security-series-unknown--9e6d25d2,Manifold Technology,https://www.crunchbase.com/organization/manifold-security,Venture - Series Unknown,6666683,USD,6666683,2017-10-20,"Information Technology, Internet","Sunnyvale, California, United States, North America",Less than $1M,1,
Series A - Dave,https://www.crunchbase.com/funding_round/dave-com-series-a--43e6b5c2,Dave,https://www.crunchbase.com/organization/dave-com,Series A,10000000,USD,10000000,2017-10-20,"FinTech, Internet","Los Angeles, California, United States, North America",$1M to $10M,6,Early Stage Venture
Seed Round - ImmuneTarget,https://www.crunchbase.com/funding_round/immunetarget-seed--eccdf385,ImmuneTarget,https://www.crunchbase.com/organization/immunetarget,Seed,856800,USD,856800,2017-10-22,"Fitness, Health Care","San Diego, California, United States, North America",,1,Seed
Venture Round - Cred,https://www.crunchbase.com/funding_round/libra-credit-network-series-unknown--300e8e0b,Cred,https://www.crunchbase.com/organization/libra-credit-network,Venture - Series Unknown,,,,2017-10-22,"B2B, B2C, Big Data, Bitcoin, Financial Services","San Francisco, California, United States, North America",,6,
Convertible Note - Biovirtua,https://www.crunchbase.com/funding_round/biovirtua-convertible-note--57c5b5fc,Biovirtua,https://www.crunchbase.com/organization/biovirtua,Convertible Note,,,,2017-10-23,"Health Care, Health Diagnostics, Medical","San Francisco, California, United States, North America",Less than $1M,2,
Seed Round - Zero,https://www.crunchbase.com/funding_round/zero-financial-seed--594fa41c,Zero,https://www.crunchbase.com/organization/zero-financial,Seed,8500000,USD,8500000,2017-10-23,"Banking, Credit Cards, Financial Services","San Francisco, California, United States, North America",$10M to $50M,5,Early Stage Venture
Series B - Abra,https://www.crunchbase.com/funding_round/abra-series-b--e1024e40,Abra,https://www.crunchbase.com/organization/abra,Series B,18500000,USD,18500000,2017-10-23,"Bitcoin, Financial Services, Peer to Peer, Transaction Processing","Mountain View, California, United States, North America",$1M to $10M,9,Late Stage Venture
Series A - Jiko,https://www.crunchbase.com/funding_round/jiko-series-a--8aa45b2b,Jiko,https://www.crunchbase.com/organization/jiko,Series A,7700000,USD,7700000,2017-10-23,"Banking, Financial Services, FinTech","Oakland, California, United States, North America",$1M to $10M,3,Early Stage Venture
Venture Round - SmartDrive Systems,https://www.crunchbase.com/funding_round/smartdrive-systems-series-unknown--3896bdfa,SmartDrive Systems,https://www.crunchbase.com/organization/smartdrive-systems,Venture - Series Unknown,,,,2017-10-23,"Analytics, Information Technology, Public Safety","San Diego, California, United States, North America",$50M to $100M,8,
Series C - Claret Medical,https://www.crunchbase.com/funding_round/claret-medical-series-c--a86cb263,Claret Medical,https://www.crunchbase.com/organization/claret-medical,Series C,14500000,USD,14500000,2017-10-23,"Health Care, Medical, Medical Device","Santa Rosa, California, United States, North America",,7,M&A
Series A - Solvvy,https://www.crunchbase.com/funding_round/solvvy-inc-series-a--e033a877,Solvvy,https://www.crunchbase.com/organization/solvvy-inc,Series A,12000000,USD,12000000,2017-10-23,"Artificial Intelligence, Customer Service, Information Technology, Internet, Machine Learning, SaaS","San Mateo, California, United States, North America",$1M to $10M,2,Early Stage Venture
Seed Round - HOWTOO,https://www.crunchbase.com/funding_round/howtoo-seed--af576c4d,HOWTOO,https://www.crunchbase.com/organization/howtoo,Seed,220000,USD,220000,2017-10-23,Information Technology,"Bakersfield, California, United States, North America",,1,Seed
Seed Round - Elyse,https://www.crunchbase.com/funding_round/elyse-seed--cf548eeb,Elyse,https://www.crunchbase.com/organization/elyse,Seed,,,,2017-10-24,"Artificial Intelligence, Health Care, Software, Wellness","San Francisco, California, United States, North America",,2,
Series A - Harness,https://www.crunchbase.com/funding_round/harness-512d-series-a--e9c5233f,Harness,https://www.crunchbase.com/organization/harness-512d,Series A,20000000,USD,20000000,2017-10-24,"Artificial Intelligence, Big Data, Delivery, Developer Tools, Information Technology, SaaS, Software","San Francisco, California, United States, North America",Less than $1M,2,Early Stage Venture
Venture Round - NeuroPace,https://www.crunchbase.com/funding_round/neuropace-series-unknown--fe73cfeb,NeuroPace,https://www.crunchbase.com/organization/neuropace,Venture - Series Unknown,74000000,USD,74000000,2017-10-24,"Health Care, Manufacturing, Medical Device, Neuroscience","Mountain View, California, United States, North America",$10M to $50M,4,
Seed Round - Feel,https://www.crunchbase.com/funding_round/sentio-solutions-inc-seed--8b566c55,Feel,https://www.crunchbase.com/organization/sentio-solutions-inc,Seed,,,,2017-10-24,"Biotechnology, Health Care, Health Diagnostics, Health Insurance, Medical Device, Psychology","San Francisco, California, United States, North America",$1M to $10M,10,Seed
Series C - HashiCorp,https://www.crunchbase.com/funding_round/hashicorp-series-c--6457d915,HashiCorp,https://www.crunchbase.com/organization/hashicorp,Series C,40000000,USD,40000000,2017-10-24,"Cloud Infrastructure, Cyber Security, Information Technology, Infrastructure, Private Cloud, Productivity Tools, Software","San Francisco, California, United States, North America",$100M to $500M,5,Late Stage Venture
Series B - NimbleRx,https://www.crunchbase.com/funding_round/nimble-pharmacy-series-b--64ba71c8,NimbleRx,https://www.crunchbase.com/organization/nimble-pharmacy,Series B,28000000,USD,28000000,2017-10-24,"E-Commerce, Health Care, Medical, Mobile, Pharmaceutical","Menlo Park, California, United States, North America",$1M to $10M,5,Late Stage Venture
Grant - Neural Analytics,https://www.crunchbase.com/funding_round/neural-analytics-grant--97b4e959,Neural Analytics,https://www.crunchbase.com/organization/neural-analytics,Grant,10000000,USD,10000000,2017-10-24,"Biotechnology, Health Care, Medical Device","Los Angeles, California, United States, North America",$1M to $10M,11,Late Stage Venture
Series A - Deserve,https://www.crunchbase.com/funding_round/deserve-series-a--4197f459,Deserve,https://www.crunchbase.com/organization/deserve,Series A,12000000,USD,12000000,2017-10-24,"Big Data, Credit Cards, Financial Services, FinTech, Internet, Mobile Payments","Menlo Park, California, United States, North America",$1M to $10M,7,Late Stage Venture
Venture Round - Credit Sesame,https://www.crunchbase.com/funding_round/credit-sesame-series-unknown--2ca52887,Credit Sesame,https://www.crunchbase.com/organization/credit-sesame,Venture - Series Unknown,26600000,USD,26600000,2017-10-25,"Consumer, Credit, Credit Cards, Finance, FinTech","Mountain View, California, United States, North America",$1M to $10M,9,Late Stage Venture
Corporate Round - LISNR,https://www.crunchbase.com/funding_round/lisnr-llc-corporate-round--1743f7ed,LISNR,https://www.crunchbase.com/organization/lisnr-llc,Corporate Round,,,,2017-10-25,"Audio, Automotive, FinTech, Internet of Things, Mobile, Mobile Payments, Retail Technology, Ticketing, Transportation","Oakland, California, United States, North America",$1M to $10M,10,
Debt Financing - Credit Sesame,https://www.crunchbase.com/funding_round/credit-sesame-debt-financing--b607da8f,Credit Sesame,https://www.crunchbase.com/organization/credit-sesame,Debt Financing,15500000,USD,15500000,2017-10-25,"Consumer, Credit, Credit Cards, Finance, FinTech","Mountain View, California, United States, North America",$1M to $10M,9,Late Stage Venture
Post-IPO Equity - TriplePoint Venture Growth,https://www.crunchbase.com/funding_round/triplepoint-venture-growth-post-ipo-equity--5420aba7,TriplePoint Venture Growth,https://www.crunchbase.com/organization/triplepoint-venture-growth,Post-IPO Equity,22000000,USD,22000000,2017-10-25,"Finance, FinTech","Menlo Park, California, United States, North America",$10M to $50M,1,IPO
Seed Round - CMLM Holdings,https://www.crunchbase.com/funding_round/cmlm-holdings-seed--38c1001d,CMLM Holdings,https://www.crunchbase.com/organization/cmlm-holdings,Seed,300000,USD,300000,2017-10-25,Information Technology,"San Francisco, California, United States, North America",,1,Seed
Post-IPO Equity - Ignyta,https://www.crunchbase.com/funding_round/ignyta-post-ipo-equity--7b1eff11,Ignyta,https://www.crunchbase.com/organization/ignyta,Post-IPO Equity,160000000,USD,160000000,2017-10-25,"Biotechnology, Health Care, Health Diagnostics","San Diego, California, United States, North America",Less than $1M,9,M&A
Private Equity Round - Generate Capital,https://www.crunchbase.com/funding_round/generate-capital-private-equity--b141a0d7,Generate Capital,https://www.crunchbase.com/organization/generate-capital,Private Equity,200000000,USD,200000000,2017-10-25,"Financial Services, IaaS, Renewable Energy, Solar, Sustainability","San Francisco, California, United States, North America",$10M to $50M,3,
Venture Round - Epiodyne,https://www.crunchbase.com/funding_round/epiodyne-series-unknown--9b477fa3,Epiodyne,https://www.crunchbase.com/organization/epiodyne,Venture - Series Unknown,5780340,USD,5780340,2017-10-26,"Biotechnology, Health Care","San Francisco, California, United States, North America",,1,
Initial Coin Offering - Stream Token,https://www.crunchbase.com/funding_round/stream-token-initial-coin-offering--5691758d,Stream Token,https://www.crunchbase.com/organization/stream-token,Initial Coin Offering,5000000,USD,5000000,2017-10-26,"Blockchain, Information Technology, Internet, Payments","San Francisco, California, United States, North America",,1,
Seed Round - Omniex,https://www.crunchbase.com/funding_round/omniex-seed--aa743888,Omniex,https://www.crunchbase.com/organization/omniex,Seed,5000000,USD,5000000,2017-10-26,"Blockchain, Cryptocurrency, Finance, Financial Services, Software, Trading Platform","San Francisco, California, United States, North America",$1M to $10M,2,
