Venture Round - MiNDERA Corporation,https://www.crunchbase.com/funding_round/mindera-corporation-series-unknown--4eff50fd,MiNDERA Corporation,https://www.crunchbase.com/organization/mindera-corporation,Venture - Series Unknown,2927147,USD,2927147,2018-11-16,"Health Care, Medical","South San Francisco, California, United States, North America",Less than $1M,4,
Seed Round - Youper,https://www.crunchbase.com/funding_round/youper-seed--bda37829,Youper,https://www.crunchbase.com/organization/youper,Seed,530000,USD,530000,2018-11-16,"Artificial Intelligence, Health Care, mHealth","San Francisco, California, United States, North America",Less than $1M,3,Seed
Venture Round - Zero,https://www.crunchbase.com/funding_round/zero-financial-series-unknown--6134a992,Zero,https://www.crunchbase.com/organization/zero-financial,Venture - Series Unknown,16000000,USD,16000000,2018-11-17,"Banking, Credit Cards, Financial Services","San Francisco, California, United States, North America",$10M to $50M,5,Early Stage Venture
Series B - UNYQ,https://www.crunchbase.com/funding_round/unyq-2-series-b--0d5e835b,UNYQ,https://www.crunchbase.com/organization/unyq-2,Series B,4646718,USD,4646718,2018-11-18,"3D Printing, Big Data, Fashion, Health Care, Internet of Things, Personal Health","San Francisco, California, United States, North America",$1M to $10M,9,Early Stage Venture
Seed Round - Zabala Farms Group,https://www.crunchbase.com/funding_round/zabala-farms-group-seed--f93718cc,Zabala Farms Group,https://www.crunchbase.com/organization/zabala-farms-group,Seed,214000,USD,214000,2018-11-19,Information Technology,"Temecula, California, United States, North America",,1,Seed
Series C - Plastiq,https://www.crunchbase.com/funding_round/plastiq-series-c--38555afc,Plastiq,https://www.crunchbase.com/organization/plastiq,Series C,27000000,USD,27000000,2018-11-19,"Credit Cards, E-Commerce, Financial Services, FinTech, Payments","San Francisco, California, United States, North America",$50M to $100M,8,Late Stage Venture
Grant - Hamilton Families,https://www.crunchbase.com/funding_round/hamilton-families-grant--046a5fef,Hamilton Families,https://www.crunchbase.com/organization/hamilton-families,Grant,2500000,USD,2500000,2018-11-20,Health Care,"San Francisco, California, United States, North America",,1,
Venture Round - Dispatch,https://www.crunchbase.com/funding_round/dispatch-labs-series-unknown--9d595bd2,Dispatch,https://www.crunchbase.com/organization/dispatch-labs,Venture - Series Unknown,,,,2018-11-20,"Blockchain, Cryptocurrency, Financial Services, Information Technology","San Francisco, California, United States, North America",,1,M&A
Seed Round - Memoir Health,https://www.crunchbase.com/funding_round/memoir-health-seed--64f19e08,Memoir Health,https://www.crunchbase.com/organization/memoir-health,Seed,,,,2018-11-20,"Health Care, Medical, Neuroscience","San Francisco, California, United States, North America",Less than $1M,1,Seed
Venture Round - BoxUnion,https://www.crunchbase.com/funding_round/boxunion-series-unknown--978f5145,BoxUnion,https://www.crunchbase.com/organization/boxunion,Venture - Series Unknown,3300000,USD,3300000,2018-11-20,"Beauty, Fitness, Health Care, Personal Health","Santa Monica, California, United States, North America",Less than $1M,2,
Seed Round - Tokyo Black,https://www.crunchbase.com/funding_round/tokyo-black-seed--98951711,Tokyo Black,https://www.crunchbase.com/organization/tokyo-black,Seed,180000,USD,180000,2018-11-21,Information Technology,"San Francisco, California, United States, North America",,1,Seed
Seed Round - Squadcast,https://www.crunchbase.com/funding_round/squadcast-d690-seed--eedb0af1,Squadcast,https://www.crunchbase.com/organization/squadcast-d690,Seed,2100000,USD,2100000,2018-11-21,Information Technology,"Palo Alto, California, United States, North America",$1M to $10M,1,Seed
Series C - Xtraction Services,https://www.crunchbase.com/funding_round/xtraction-services-series-c--0d1669bc,Xtraction Services,https://www.crunchbase.com/organization/xtraction-services,Series C,3000000,USD,3000000,2018-11-21,"Cannabis, Financial Services, Leasing","Los Angeles, California, United States, North America",$1M to $10M,4,Late Stage Venture
Series A - Securitize,https://www.crunchbase.com/funding_round/securitize-inc-series-a--1f2396c0,Securitize,https://www.crunchbase.com/organization/securitize-inc,Series A,12750000,USD,12750000,2018-11-26,"Blockchain, Cryptocurrency, Finance, Financial Services, FinTech, Information Technology, Software","San Francisco, California, United States, North America",Less than $1M,6,Early Stage Venture
Venture Round - SAFE,https://www.crunchbase.com/funding_round/safe-2-series-unknown--7ad9e0a9,SAFE,https://www.crunchbase.com/organization/safe-2,Venture - Series Unknown,,,,2018-11-26,"Apps, Blockchain, Health Care, Information Technology, Software","Santa Monica, California, United States, North America",,3,Early Stage Venture
Seed Round - Token Group,https://www.crunchbase.com/funding_round/token-group-seed--2153d693,Token Group,https://www.crunchbase.com/organization/token-group,Seed,,,,2018-11-26,"Blockchain, Consulting, Cryptocurrency, Financial Services, FinTech, Information Technology, Internet","Beverly Hills, California, United States, North America",,1,Seed
Series A - Charlie Finance,https://www.crunchbase.com/funding_round/charlie-91e1-series-a--0f4c4c09,Charlie Finance,https://www.crunchbase.com/organization/charlie-91e1,Series A,9000000,USD,9000000,2018-11-26,"Finance, Financial Services, FinTech, Intelligent Systems, Software","San Francisco, California, United States, North America",$1M to $10M,3,
Venture Round - Vetica Labs,https://www.crunchbase.com/funding_round/vetica-labs-series-unknown--32c8271a,Vetica Labs,https://www.crunchbase.com/organization/vetica-labs,Venture - Series Unknown,3999000,USD,3999000,2018-11-27,"Biotechnology, Health Care, Life Science","San Diego, California, United States, North America",,2,
Private Equity Round - Hart,https://www.crunchbase.com/funding_round/hart-private-equity--7129d303,Hart,https://www.crunchbase.com/organization/hart,Private Equity,,,,2018-11-27,"Data Integration, Developer Platform, Health Care","Costa Mesa, California, United States, North America",$1M to $10M,1,Private Equity
Debt Financing - Visionary Integration Professionals,https://www.crunchbase.com/funding_round/visionary-integration-professionals-debt-financing--28037162,Visionary Integration Professionals,https://www.crunchbase.com/organization/visionary-integration-professionals,Debt Financing,47269186,USD,47269186,2018-11-27,"CRM, Information Technology, Management Consulting, Robotics, Software","Folsom, California, United States, North America",$10M to $50M,2,Early Stage Venture
Seed Round - Keyto,https://www.crunchbase.com/funding_round/keyto-seed--8609f9a2,Keyto,https://www.crunchbase.com/organization/keyto,Seed,2500000,USD,2500000,2018-11-27,"Beauty, Food and Beverage, Health Care, Nutrition","San Francisco, California, United States, North America",,2,Seed
Product Crowdfunding - Keyto,https://www.crunchbase.com/funding_round/keyto-product-crowdfunding--290a3db4,Keyto,https://www.crunchbase.com/organization/keyto,Product Crowdfunding,1100000,USD,1100000,2018-11-27,"Beauty, Food and Beverage, Health Care, Nutrition","San Francisco, California, United States, North America",,2,Seed
Seed Round - Shipsi,https://www.crunchbase.com/funding_round/shipsi-inc-seed--56206e94,Shipsi,https://www.crunchbase.com/organization/shipsi-inc,Seed,1900000,USD,1900000,2018-11-28,"E-Commerce, Information Services, Information Technology","Venice, California, United States, North America",$1M to $10M,6,Seed
Series E - Auris Health,https://www.crunchbase.com/funding_round/auris-surgical-robotics-series-e--03b0bb0c,Auris Health,https://www.crunchbase.com/organization/auris-surgical-robotics,Series E,220000000,USD,220000000,2018-11-28,"Biotechnology, Health Care, Medical, Medical Device, Robotics","Redwood City, California, United States, North America",$50M to $100M,8,M&A
Seed Round - Feel,https://www.crunchbase.com/funding_round/sentio-solutions-inc-seed--84ac060d,Feel,https://www.crunchbase.com/organization/sentio-solutions-inc,Seed,,,,2018-11-28,"Biotechnology, Health Care, Health Diagnostics, Health Insurance, Medical Device, Psychology","San Francisco, California, United States, North America",$1M to $10M,10,Seed
Series B - Prescient Surgical,https://www.crunchbase.com/funding_round/prescient-surgical-series-b--f6224ef5,Prescient Surgical,https://www.crunchbase.com/organization/prescient-surgical,Series B,10000000,USD,10000000,2018-11-28,"Fitness, Health Care","Mountain View, California, United States, North America",Less than $1M,2,Early Stage Venture
Seed Round - Tombot,https://www.crunchbase.com/funding_round/tombot-seed--d6db4d9f,Tombot,https://www.crunchbase.com/organization/tombot,Seed,700000,USD,700000,2018-11-29,"Consumer Electronics, Health Care, Robotics","Valencia, California, United States, North America",,2,Seed
Venture Round - OralEye,https://www.crunchbase.com/funding_round/oraleye-series-unknown--03cecd89,OralEye,https://www.crunchbase.com/organization/oraleye,Venture - Series Unknown,,,,2018-11-29,"Apps, Dental, Health Care, Medical, mHealth, Mobile","San Francisco, California, United States, North America",Less than $1M,1,
Series D - ViaCyte,https://www.crunchbase.com/funding_round/viacyte-series-d--0c627b2a,ViaCyte,https://www.crunchbase.com/organization/viacyte,Series D,80000000,USD,80000000,2018-11-29,"Biotechnology, Diabetes, Health Care, Medical, Therapeutics","San Diego, California, United States, North America",$10M to $50M,14,
Venture Round - Retrotope,https://www.crunchbase.com/funding_round/retrotope-series-unknown--7a7e9879,Retrotope,https://www.crunchbase.com/organization/retrotope,Venture - Series Unknown,8049264,USD,8049264,2018-11-30,"Biotechnology, Health Care, Medical","Los Altos Hills, California, United States, North America",Less than $1M,4,
Debt Financing - Karius,https://www.crunchbase.com/funding_round/karius-debt-financing--ea7f3340,Karius,https://www.crunchbase.com/organization/karius,Debt Financing,25000000,USD,25000000,2018-11-30,"Biotechnology, Genetics, Information Technology, Life Science","Redwood City, California, United States, North America",$1M to $10M,4,Early Stage Venture
Seed Round - Myia Labs,https://www.crunchbase.com/funding_round/myia-labs-seed--33b45e36,Myia Labs,https://www.crunchbase.com/organization/myia-labs,Seed,6750000,USD,6750000,2018-11-30,"Artificial Intelligence, Health Care, Machine Learning","San Francisco, California, United States, North America",,2,Early Stage Venture
Seed Round - Proper,https://www.crunchbase.com/funding_round/proper-cb14-seed--634e36d6,Proper,https://www.crunchbase.com/organization/proper-cb14,Seed,3333333,USD,3333333,2018-12-01,"Information Technology, Mobile Apps, Real Estate, Software","San Francisco, California, United States, North America",$10M to $50M,1,Seed
Seed Round - OurHealthMate,https://www.crunchbase.com/funding_round/ourhealthmate-seed--6ca337e6,OurHealthMate,https://www.crunchbase.com/organization/ourhealthmate,Seed,,,,2018-12-01,"Health Care, Information Technology, Personal Health, Wellness","San Francisco, California, United States, North America",Less than $1M,4,Seed
Series A - Long Game,https://www.crunchbase.com/funding_round/long-game-series-a--03ed4870,Long Game,https://www.crunchbase.com/organization/long-game,Series A,10000000,USD,10000000,2018-12-01,"Finance, Financial Services, FinTech","San Francisco, California, United States, North America",Less than $1M,4,
Series A - Securitize,https://www.crunchbase.com/funding_round/securitize-inc-series-a--44637700,Securitize,https://www.crunchbase.com/organization/securitize-inc,Series A,,,,2018-12-01,"Blockchain, Cryptocurrency, Finance, Financial Services, FinTech, Information Technology, Software","San Francisco, California, United States, North America",Less than $1M,6,Early Stage Venture
Debt Financing - Branch International,https://www.crunchbase.com/funding_round/branch-intl-debt-financing--6365f5fd,Branch International,https://www.crunchbase.com/organization/branch-intl,Debt Financing,5000000,USD,5000000,2018-12-01,"Apps, Finance, Financial Services, FinTech","San Francisco, California, United States, North America",$100M to $500M,8,Late Stage Venture
Venture Round - Kuli Kuli,https://www.crunchbase.com/funding_round/kuli-kuli-series-unknown--51eecc7e,Kuli Kuli,https://www.crunchbase.com/organization/kuli-kuli,Venture - Series Unknown,,,,2018-12-01,"Health Care, Nutrition","Oakland, California, United States, North America",$1M to $10M,5,Early Stage Venture
Seed Round - CUDDLY Inc.,https://www.crunchbase.com/funding_round/poundwishes-inc--seed--72e57ad6,CUDDLY Inc.,https://www.crunchbase.com/organization/poundwishes-inc-,Seed,1080000,USD,1080000,2018-12-01,"Crowdfunding, Information Technology, Pet","Seal Beach, California, United States, North America",,7,Seed
Seed Round - Kava Labs,https://www.crunchbase.com/funding_round/kava-labs-seed--594631fd,Kava Labs,https://www.crunchbase.com/organization/kava-labs,Seed,,,,2018-12-01,"Blockchain, Cryptocurrency, FinTech, Information Technology","San Francisco, California, United States, North America",,4,
"Pre Seed Round - Solecular, Inc.",https://www.crunchbase.com/funding_round/solecular-inc-pre-seed--49408313,"Solecular, Inc.",https://www.crunchbase.com/organization/solecular-inc,Pre-Seed,300000,USD,300000,2018-12-01,"Artificial Intelligence, CRM, Information Technology, Internet, SaaS, Small and Medium Businesses, Software","Sunnyvale, California, United States, North America",,4,Seed
Pre Seed Round - AHEAD Medicine,https://www.crunchbase.com/funding_round/ahead-b7b9-pre-seed--1c82a5d8,AHEAD Medicine,https://www.crunchbase.com/organization/ahead-b7b9,Pre-Seed,870000,USD,870000,2018-12-01,"Artificial Intelligence, Biotechnology, Health Care, Health Diagnostics","Berkeley, California, United States, North America",,1,Seed
Corporate Round - Inversation,https://www.crunchbase.com/funding_round/inversation-corporate-round--e4e2bafc,Inversation,https://www.crunchbase.com/organization/inversation,Corporate Round,,,,2018-12-01,"Artificial Intelligence, Information Technology, Machine Learning, Sales Automation","San Francisco, California, United States, North America",,1,
"Seed Round - Lynx therapeutics, inc.",https://www.crunchbase.com/funding_round/lynx-therapeutics-inc-seed--22748ce0,"Lynx therapeutics, inc.",https://www.crunchbase.com/organization/lynx-therapeutics-inc,Seed,,,,2018-12-01,"Biotechnology, Health Care","Hayward, California, United States, North America",$10M to $50M,1,Seed
Seed Round - Back Porch Homes,https://www.crunchbase.com/funding_round/back-porch-homes-seed--0d33a3a3,Back Porch Homes,https://www.crunchbase.com/organization/back-porch-homes,Seed,350000,USD,350000,2018-12-01,"Finance, Manufacturing, Real Estate","Riverside, California, United States, North America",,1,Seed
Seed Round - SIMPLIFY REALITY INC.,https://www.crunchbase.com/funding_round/simplify-reality-inc-seed--5cd097bf,SIMPLIFY REALITY INC.,https://www.crunchbase.com/organization/simplify-reality-inc,Seed,2000000,USD,2000000,2018-12-01,"Artificial Intelligence, Information Technology","Los Angeles, California, United States, North America",Less than $1M,2,Seed
Series A - ThriveCash,https://www.crunchbase.com/funding_round/thrive-cash-series-a--71766833,ThriveCash,https://www.crunchbase.com/organization/thrive-cash,Series A,8000000,USD,8000000,2018-12-01,"Education, Finance, Financial Exchanges, Financial Services","San Francisco, California, United States, North America",$1M to $10M,2,Early Stage Venture
"Convertible Note - SPARE CS, INC",https://www.crunchbase.com/funding_round/spare-cs-inc-convertible-note--8af05fe4,"SPARE CS, INC",https://www.crunchbase.com/organization/spare-cs-inc,Convertible Note,100000,USD,100000,2018-12-01,"Android, Banking, Consumer Software, Digital Marketing, Financial Services, FinTech, iOS, Peer to Peer, Point of Sale, Virtual Currency","West Hollywood, California, United States, North America",$1M to $10M,4,Seed
Seed Round - Formulate,https://www.crunchbase.com/funding_round/formulate-co-seed--673fdb54,Formulate,https://www.crunchbase.com/organization/formulate-co,Seed,,,,2018-12-01,"Beauty, Consumer Goods, Health Care","Menlo Park, California, United States, North America",,1,Seed
Pre Seed Round - VoiceMe.AI,https://www.crunchbase.com/funding_round/voiceme-ai-pre-seed--3b775843,VoiceMe.AI,https://www.crunchbase.com/organization/voiceme-ai,Pre-Seed,,,,2018-12-01,"Information Technology, Internet, Messaging, Software","San Francisco, California, United States, North America",,3,Seed
Seed Round - Revive Solutions,https://www.crunchbase.com/funding_round/revive-solutions-seed--e45f4fa2,Revive Solutions,https://www.crunchbase.com/organization/revive-solutions,Seed,3400000,USD,3400000,2018-12-03,Health Care,"San Francisco, California, United States, North America",,4,Early Stage Venture
Seed Round - Techmetics Robotics,https://www.crunchbase.com/funding_round/techmetics-seed--e3c575e0,Techmetics Robotics,https://www.crunchbase.com/organization/techmetics,Seed,500000,SGD,365898,2018-12-03,"Assisted Living, Health Care, Hospitality, Retail Technology, Robotics","San Jose, California, United States, North America",,3,Seed
Series A - Citcon,https://www.crunchbase.com/funding_round/citcon-2-series-a--fc349eca,Citcon,https://www.crunchbase.com/organization/citcon-2,Series A,6000000,USD,6000000,2018-12-04,"FinTech, Marketing, Mobile Payments, Travel","Santa Clara, California, United States, North America",$1M to $10M,3,Early Stage Venture
Seed Round - Unit21,https://www.crunchbase.com/funding_round/unit21-seed--921da614,Unit21,https://www.crunchbase.com/organization/unit21,Seed,,,,2018-12-04,"Financial Services, FinTech, Fraud Detection, GovTech, Software","San Francisco, California, United States, North America",,1,Seed
Series A - FortressIQ,https://www.crunchbase.com/funding_round/fortressiq-series-a--bc59197b,FortressIQ,https://www.crunchbase.com/organization/fortressiq,Series A,12000000,USD,12000000,2018-12-04,"Artificial Intelligence, Business Intelligence, Data Center Automation, Information Technology, Software","San Francisco, California, United States, North America",,2,Early Stage Venture
Series B - MoEngage,https://www.crunchbase.com/funding_round/moengage-series-b--55a0ef17,MoEngage,https://www.crunchbase.com/organization/moengage,Series B,9000000,USD,9000000,2018-12-04,"Analytics, Digital Marketing, Information Technology, Internet, Marketing Automation, Mobile, SaaS","San Francisco, California, United States, North America",$10M to $50M,5,Late Stage Venture
Debt Financing - Vantage Data Centers,https://www.crunchbase.com/funding_round/vantage-data-centers-debt-financing--44ce4ab8,Vantage Data Centers,https://www.crunchbase.com/organization/vantage-data-centers,Debt Financing,225000000,USD,225000000,2018-12-04,"Data Center Automation, Database, Information Services, Information Technology","Santa Clara, California, United States, North America",$10M to $50M,9,M&A
Series A - 15Five,https://www.crunchbase.com/funding_round/15five-series-a--08eb703c,15Five,https://www.crunchbase.com/organization/15five,Series A,8200000,USD,8200000,2018-12-04,"Enterprise Software, Human Resources, Information Technology, SaaS, Software","San Francisco, California, United States, North America",$1M to $10M,5,Early Stage Venture
Seed Round - MDacne,https://www.crunchbase.com/funding_round/mdalgorithms-seed--905e77b4,MDacne,https://www.crunchbase.com/organization/mdalgorithms,Seed,750000,USD,750000,2018-12-04,"Fitness, Health Care, Health Diagnostics, Wellness","San Francisco, California, United States, North America",$1M to $10M,3,Seed
Pre Seed Round - WeCare,https://www.crunchbase.com/funding_round/wecare-pre-seed--b673deb1,WeCare,https://www.crunchbase.com/organization/wecare,Pre-Seed,100000,USD,100000,2018-12-05,"Biopharma, Clinical Trials, Health Care, Hospital, Information Technology, Medical","Los Angeles, California, United States, North America",,1,Seed
Series C - Alto Pharmacy,https://www.crunchbase.com/funding_round/scriptdash-series-c--34f50a1c,Alto Pharmacy,https://www.crunchbase.com/organization/scriptdash,Series C,50000000,USD,50000000,2018-12-05,"Consumer, E-Commerce, Health Care, Medical, Pharmaceutical","San Francisco, California, United States, North America",$10M to $50M,6,Late Stage Venture
Grant - Respira Labs,https://www.crunchbase.com/funding_round/respira-labs-grant--3e844a47,Respira Labs,https://www.crunchbase.com/organization/respira-labs,Grant,25000,USD,25000,2018-12-05,"Health Care, Machine Learning, Medical Device, Wearables","Mountain View, California, United States, North America",,6,Seed
Private Equity Round - Vagaro,https://www.crunchbase.com/funding_round/vagaro-private-equity--98fe3009,Vagaro,https://www.crunchbase.com/organization/vagaro,Private Equity,63000000,USD,63000000,2018-12-05,"Beauty, Fashion, Health Care, Lifestyle, Online Portals","Dublin, California, United States, North America",Less than $1M,1,Private Equity
"Series C - 5 Point Medical, Inc.",https://www.crunchbase.com/funding_round/5-point-medical-inc-series-c--eb2569d2,"5 Point Medical, Inc.",https://www.crunchbase.com/organization/5-point-medical-inc,Series C,25000000,USD,25000000,2018-12-05,"Health Care, Hospital, Lead Generation, Medical, SaaS","San Francisco, California, United States, North America",,2,Late Stage Venture
Seed Round - MDout,https://www.crunchbase.com/funding_round/mdout-seed--04b6cbff,MDout,https://www.crunchbase.com/organization/mdout,Seed,500000,USD,500000,2018-12-06,"Analytics, Biotechnology, Health Care, Information Technology, Service Industry","Livermore, California, United States, North America",,1,Seed
Series D - Shockwave Medical,https://www.crunchbase.com/funding_round/shockwave-medical-series-d--23aa9db4,Shockwave Medical,https://www.crunchbase.com/organization/shockwave-medical,Series D,15000000,USD,15000000,2018-12-06,"Health Care, Medical, Medical Device","Fremont, California, United States, North America",$10M to $50M,5,IPO
Non Equity Assistance - Productfy,https://www.crunchbase.com/funding_round/productfy-non-equity-assistance--7acc302a,Productfy,https://www.crunchbase.com/organization/productfy,Non-equity Assistance,,,,2018-12-06,"Financial Services, FinTech, Software","San Jose, California, United States, North America",,2,Seed
Series B - Happiest Baby,https://www.crunchbase.com/funding_round/happiest-baby-series-b--f2726350,Happiest Baby,https://www.crunchbase.com/organization/happiest-baby,Series B,23000000,USD,23000000,2018-12-06,"Children, Health Care, Internet of Things, Life Science","Santa Monica, California, United States, North America",$1M to $10M,2,Early Stage Venture
Seed Round - Firefly,https://www.crunchbase.com/funding_round/firefly-3919-seed--61e0298f,Firefly,https://www.crunchbase.com/organization/firefly-3919,Seed,21500000,USD,21500000,2018-12-06,"Advertising Platforms, Information Technology, Smart Cities","San Francisco, California, United States, North America",$10M to $50M,4,Early Stage Venture
Non Equity Assistance - Class Action,https://www.crunchbase.com/funding_round/class-action-inc-non-equity-assistance--9102961c,Class Action,https://www.crunchbase.com/organization/class-action-inc,Non-equity Assistance,,,,2018-12-06,"Finance, Financial Services, Payments","San Francisco, California, United States, North America",,1,
Venture Round - Hippeas,https://www.crunchbase.com/funding_round/hippeas-series-unknown--5ac7b898,Hippeas,https://www.crunchbase.com/organization/hippeas,Venture - Series Unknown,8000000,USD,8000000,2018-12-07,"Food and Beverage, Health Care, Organic Food","Los Angeles, California, United States, North America",Less than $1M,4,
Seed Round - Techmetics Robotics,https://www.crunchbase.com/funding_round/techmetics-seed--5084c204,Techmetics Robotics,https://www.crunchbase.com/organization/techmetics,Seed,1000000,SGD,727729,2018-12-10,"Assisted Living, Health Care, Hospitality, Retail Technology, Robotics","San Jose, California, United States, North America",,3,Seed
Venture Round - Ampleforth,https://www.crunchbase.com/funding_round/fragments-a7cb-series-unknown--f189aa81,Ampleforth,https://www.crunchbase.com/organization/fragments-a7cb,Venture - Series Unknown,1750000,USD,1750000,2018-12-10,"Computer, Information Technology, Software","San Francisco, California, United States, North America",$1M to $10M,4,
Debt Financing - Sixup,https://www.crunchbase.com/funding_round/sixup-debt-financing--ff8b0565,Sixup,https://www.crunchbase.com/organization/sixup,Debt Financing,27000000,USD,27000000,2018-12-10,"Big Data, EdTech, FinTech, Impact Investing","San Francisco, California, United States, North America",$1M to $10M,9,Seed
Venture Round - Amphivena Therapeutics,https://www.crunchbase.com/funding_round/amphivena-therapeutics-series-unknown--7f203110,Amphivena Therapeutics,https://www.crunchbase.com/organization/amphivena-therapeutics,Venture - Series Unknown,38694000,USD,38694000,2018-12-10,"Biotechnology, Health Care, Therapeutics","South San Francisco, California, United States, North America",$1M to $10M,5,Late Stage Venture
Seed Round - Novi Finance,https://www.crunchbase.com/funding_round/novi-finance-seed--1a7ca7b5,Novi Finance,https://www.crunchbase.com/organization/novi-finance,Seed,,,,2018-12-10,"Advice, Consulting, Finance, Financial Services, Insurance","San Francisco, California, United States, North America",,2,Seed
Venture Round - GitLab,https://www.crunchbase.com/funding_round/gitlab-com-series-unknown--37491922,GitLab,https://www.crunchbase.com/organization/gitlab-com,Venture - Series Unknown,20000000,USD,20000000,2018-12-10,"Information Technology, Open Source, Software","San Francisco, California, United States, North America",,8,Late Stage Venture
