Seed Round - Ell-iot,https://www.crunchbase.com/funding_round/ell-iot-seed--08c9e313,Ell-iot,https://www.crunchbase.com/organization/ell-iot,Seed,,,,2017-12-15,"Computer, Information Technology","Laguna Niguel, California, United States, North America",,1,Seed
Series B - OKCoin,https://www.crunchbase.com/funding_round/okcoin-series-b--1e654312,OKCoin,https://www.crunchbase.com/organization/okcoin,Series B,,,,2017-12-15,"Blockchain, Financial Services, FinTech","San Francisco, California, United States, North America",$10M to $50M,2,Early Stage Venture
Convertible Note - Camino Financial,https://www.crunchbase.com/funding_round/camino-financial-convertible-note--82be4cfb,Camino Financial,https://www.crunchbase.com/organization/camino-financial,Convertible Note,500000,USD,500000,2017-12-15,"Commercial Lending, Credit, Financial Services, FinTech, Small and Medium Businesses","Los Angeles, California, United States, North America",$1M to $10M,9,Early Stage Venture
Seed Round - Wellth,https://www.crunchbase.com/funding_round/wellth-seed--9eb6bcf8,Wellth,https://www.crunchbase.com/organization/wellth,Seed,,,,2017-12-15,"Health Care, Information Technology, mHealth, Personal Health","Los Angeles, California, United States, North America",Less than $1M,5,Seed
Debt Financing - Sixup,https://www.crunchbase.com/funding_round/sixup-debt-financing--684a72a0,Sixup,https://www.crunchbase.com/organization/sixup,Debt Financing,13000000,USD,13000000,2017-12-15,"Big Data, EdTech, FinTech, Impact Investing","San Francisco, California, United States, North America",$1M to $10M,9,Seed
Venture Round - Mursion,https://www.crunchbase.com/funding_round/mursion-series-unknown--d058c5bd,Mursion,https://www.crunchbase.com/organization/mursion,Venture - Series Unknown,2549866,USD,2549866,2017-12-15,"Augmented Reality, Education, Health Care, Software, Virtual Reality","San Francisco, California, United States, North America",$1M to $10M,3,Early Stage Venture
Venture Round - Cred,https://www.crunchbase.com/funding_round/libra-credit-network-series-unknown--7f40020e,Cred,https://www.crunchbase.com/organization/libra-credit-network,Venture - Series Unknown,2000000,USD,2000000,2017-12-18,"B2B, B2C, Big Data, Bitcoin, Financial Services","San Francisco, California, United States, North America",,6,
Series A - Stitch Health,https://www.crunchbase.com/funding_round/stitchhealth-series-a--6ea96c86,Stitch Health,https://www.crunchbase.com/organization/stitchhealth,Series A,,,,2017-12-18,"Health Care, Internet","San Francisco, California, United States, North America",,2,Early Stage Venture
Series B - Bigfoot Biomedical,https://www.crunchbase.com/funding_round/bigfoot-biomedical--inc--series-b--90768d55,Bigfoot Biomedical,https://www.crunchbase.com/organization/bigfoot-biomedical--inc-,Series B,37000000,USD,37000000,2017-12-18,"Artificial Intelligence, Big Data, Diabetes, Health Care, Medical Device, mHealth, Predictive Analytics","Milpitas, California, United States, North America",$1M to $10M,5,Late Stage Venture
"Private Equity Round - PCCP, LLC (Pacific Coast Capital Partners)",https://www.crunchbase.com/funding_round/pccp-llc-pacific-coast-capital-partners-private-equity--148d95fb,"PCCP, LLC (Pacific Coast Capital Partners)",https://www.crunchbase.com/organization/pccp-llc-pacific-coast-capital-partners,Private Equity,,,,2017-12-18,"Financial Services, Insurance, Real Estate","Los Angeles, California, United States, North America",$1M to $10M,1,Private Equity
Seed Round - Celestek,https://www.crunchbase.com/funding_round/celestek-seed--3eee9dc5,Celestek,https://www.crunchbase.com/organization/celestek,Seed,,,,2017-12-18,"Apps, Artificial Intelligence, Information Technology","Berkeley, California, United States, North America",,1,Seed
Grant - Blue Shield of California Foundation,https://www.crunchbase.com/funding_round/blue-shield-of-california-foundation-grant--2051187f,Blue Shield of California Foundation,https://www.crunchbase.com/organization/blue-shield-of-california-foundation,Grant,5800000,USD,5800000,2017-12-18,"Health Care, Health Insurance, Personal Health","San Francisco, California, United States, North America",$10B+,2,
Angel Round - ConnecPath Inc. (WeAdmit.io),https://www.crunchbase.com/funding_round/connecpath-angel--14689ed7,ConnecPath Inc. (WeAdmit.io),https://www.crunchbase.com/organization/connecpath,Angel,150000,USD,150000,2017-12-18,"Education, Information Technology","Menlo Park, California, United States, North America",Less than $1M,3,Seed
Seed Round - Roswell Biotechnologies,https://www.crunchbase.com/funding_round/roswell-biotechnologies-inc-seed--0d8dd7ee,Roswell Biotechnologies,https://www.crunchbase.com/organization/roswell-biotechnologies-inc,Seed,5000000,USD,5000000,2017-12-19,"Biotechnology, Electronics, Health Care","San Diego, California, United States, North America",,2,Early Stage Venture
Series A - One Concern,https://www.crunchbase.com/funding_round/oneconcern-series-a--bb6e9643,One Concern,https://www.crunchbase.com/organization/oneconcern,Series A,18640000,USD,18640000,2017-12-19,"Analytics, Artificial Intelligence, Enterprise Software, GovTech, Information Technology, InsurTech, Machine Learning, Natural Resources, Risk Management, SaaS","Menlo Park, California, United States, North America",Less than $1M,5,Early Stage Venture
Seed Round - dYdX,https://www.crunchbase.com/funding_round/dydx-seed--6e4e442e,dYdX,https://www.crunchbase.com/organization/dydx,Seed,2000000,USD,2000000,2017-12-19,"Blockchain, Cryptocurrency, Finance, Internet","San Francisco, California, United States, North America",Less than $1M,2,Early Stage Venture
Seed Round - Bigfinite,https://www.crunchbase.com/funding_round/bigfinite-seed--c8679808,Bigfinite,https://www.crunchbase.com/organization/bigfinite,Seed,8500000,USD,8500000,2017-12-19,"Big Data, Biotechnology, Information Services, Information Technology, Internet of Things, Pharmaceutical, SaaS","San Francisco, California, United States, North America",$1M to $10M,4,Early Stage Venture
Series A - States Title,https://www.crunchbase.com/funding_round/states-title-series-a--3be3c2d3,States Title,https://www.crunchbase.com/organization/states-title,Series A,13000000,USD,13000000,2017-12-20,"Artificial Intelligence, Financial Services, FinTech, Insurance, InsurTech, Machine Learning, Real Estate","San Francisco, California, United States, North America",$10M to $50M,4,Early Stage Venture
Seed Round - Crumbs,https://www.crunchbase.com/funding_round/crumbs-6012-seed--008ce773,Crumbs,https://www.crunchbase.com/organization/crumbs-6012,Seed,175000,USD,175000,2017-12-20,"Apps, Cryptocurrency, Financial Services","Santa Clara, California, United States, North America",,1,M&A
Venture Round - Cake,https://www.crunchbase.com/funding_round/cakes-series-unknown--34ccf441,Cake,https://www.crunchbase.com/organization/cakes,Venture - Series Unknown,325000,USD,325000,2017-12-20,"Communications Infrastructure, Information Technology, Internet","Mountain View, California, United States, North America",,2,
"Angel Round - Ursus, inc",https://www.crunchbase.com/funding_round/ursus-inc-angel--65701d6f,"Ursus, inc",https://www.crunchbase.com/organization/ursus-inc,Angel,100000,USD,100000,2017-12-20,"Information Technology, Recruiting, Staffing Agency","San Francisco, California, United States, North America",$1M to $10M,2,Seed
Corporate Round - Faraday Future,https://www.crunchbase.com/funding_round/faraday-future-corporate-round--08d8ce45,Faraday Future,https://www.crunchbase.com/organization/faraday-future,Corporate Round,2000000000,USD,2000000000,2017-12-20,"Automotive, Content, Electric Vehicle, Information Technology","Gardena, California, United States, North America",,4,
Seed Round - Safesite,https://www.crunchbase.com/funding_round/safesite-seed--fa3c9d22,Safesite,https://www.crunchbase.com/organization/safesite,Seed,,,,2017-12-20,"Enterprise Software, Information Services, Information Technology, InsurTech, Mobile, Risk Management","San Francisco, California, United States, North America",$1M to $10M,3,Seed
Series B - Splice Machine,https://www.crunchbase.com/funding_round/splice-machine-series-b--5413ee5f,Splice Machine,https://www.crunchbase.com/organization/splice-machine,Series B,9000000,USD,9000000,2017-12-20,"Analytics, Big Data, Information Technology, Software","San Francisco, California, United States, North America",$1M to $10M,5,Early Stage Venture
Seed Round - Zesty.io,https://www.crunchbase.com/funding_round/zesty-io-seed--39a097c8,Zesty.io,https://www.crunchbase.com/organization/zesty-io,Seed,1500000,USD,1500000,2017-12-20,"Content, Enterprise Software, Information Services, Information Technology, Marketing, SaaS","San Diego, California, United States, North America",$1M to $10M,3,Seed
Series A - Loyyal,https://www.crunchbase.com/funding_round/loyyal-series-a--3533b0f8,Loyyal,https://www.crunchbase.com/organization/loyyal,Series A,2300000,USD,2300000,2017-12-20,"Blockchain, Enterprise Software, FinTech, Information Technology, Loyalty Programs","San Francisco, California, United States, North America",$1M to $10M,6,
Seed Round - ROOM Technology Ventures,https://www.crunchbase.com/funding_round/room-d518-seed--5e68f14a,ROOM Technology Ventures,https://www.crunchbase.com/organization/room-d518,Seed,425439,USD,425439,2017-12-20,"Hospitality, Hotel, Information Technology, Leisure, Retail Technology, SaaS, Travel","San Francisco, California, United States, North America",,2,Seed
Seed Round - DirecTech Labs,https://www.crunchbase.com/funding_round/directechlabs-seed--3f760ccc,DirecTech Labs,https://www.crunchbase.com/organization/directechlabs,Seed,250000,USD,250000,2017-12-20,"Direct Sales, Information Technology, Machine Learning, Predictive Analytics, Social CRM","Santa Monica, California, United States, North America",Less than $1M,5,Seed
Seed Round - Feel,https://www.crunchbase.com/funding_round/sentio-solutions-inc-seed--d2f40205,Feel,https://www.crunchbase.com/organization/sentio-solutions-inc,Seed,,,,2017-12-20,"Biotechnology, Health Care, Health Diagnostics, Health Insurance, Medical Device, Psychology","San Francisco, California, United States, North America",$1M to $10M,10,Seed
Seed Round - Going Merry,https://www.crunchbase.com/funding_round/going-merry-seed--054c101e,Going Merry,https://www.crunchbase.com/organization/going-merry,Seed,,,,2017-12-20,"Education, Finance","San Francisco, California, United States, North America",,1,Seed
Post-IPO Equity - ApolloMed,https://www.crunchbase.com/funding_round/apollomed-post-ipo-equity--b9ab23e2,ApolloMed,https://www.crunchbase.com/organization/apollomed,Post-IPO Equity,5200810,USD,5200810,2017-12-20,"Fitness, Health Care, Medical","Glendale, California, United States, North America",$100M to $500M,5,IPO
Venture Round - Sandstone Diagnostics,https://www.crunchbase.com/funding_round/sandstone-diagnostics-series-unknown--e8e18d72,Sandstone Diagnostics,https://www.crunchbase.com/organization/sandstone-diagnostics,Venture - Series Unknown,,,,2017-12-21,"Health Care, Health Diagnostics, Wellness","Livermore, California, United States, North America",$1M to $10M,10,Early Stage Venture
Series B - Uplift,https://www.crunchbase.com/funding_round/uplift-inc-series-b--c9ebe399,Uplift,https://www.crunchbase.com/organization/uplift-inc,Series B,15000000,USD,15000000,2017-12-21,"E-Commerce, FinTech, Information Services, Information Technology, Travel","Menlo Park, California, United States, North America",$10M to $50M,5,Late Stage Venture
Venture Round - Appetize,https://www.crunchbase.com/funding_round/appetize-series-unknown--6747079c,Appetize,https://www.crunchbase.com/organization/appetize,Venture - Series Unknown,7261270,USD,7261270,2017-12-21,"Apps, Events, Information Technology, Mobile, Software","Los Angeles, California, United States, North America",$10M to $50M,6,Early Stage Venture
Debt Financing - Uplift,https://www.crunchbase.com/funding_round/uplift-inc-debt-financing--40a388c2,Uplift,https://www.crunchbase.com/organization/uplift-inc,Debt Financing,75000000,USD,75000000,2017-12-21,"E-Commerce, FinTech, Information Services, Information Technology, Travel","Menlo Park, California, United States, North America",$10M to $50M,5,Late Stage Venture
Seed Round - Hip Sobriety,https://www.crunchbase.com/funding_round/hip-sobriety-seed--2b7d8c69,Hip Sobriety,https://www.crunchbase.com/organization/hip-sobriety,Seed,,,,2017-12-21,"Fitness, Health Care, Wellness, Wine And Spirits","San Francisco, California, United States, North America",Less than $1M,2,Seed
Seed Round - Agent IQ,https://www.crunchbase.com/funding_round/agent-iq-seed--25ee6c1b,Agent IQ,https://www.crunchbase.com/organization/agent-iq,Seed,,,,2017-12-21,"Artificial Intelligence, Customer Service, Enterprise Software, Information Services, Information Technology, Machine Learning","San Francisco, California, United States, North America",$1M to $10M,3,Seed
Initial Coin Offering - Science,https://www.crunchbase.com/funding_round/science-initial-coin-offering--3416e82a,Science,https://www.crunchbase.com/organization/science,Initial Coin Offering,12298073,USD,12298073,2017-12-21,"Finance, Financial Services, Incubators, Venture Capital","Santa Monica, California, United States, North America",,4,
Debt Financing - M7,https://www.crunchbase.com/funding_round/m7-debt-financing--dd0078db,M7,https://www.crunchbase.com/organization/m7,Debt Financing,570000000,EUR,675605200,2017-12-21,"Developer Tools, Information Technology, Software, Web Development","Boulevard, California, United States, North America",,4,M&A
Private Equity Round - Alliance-Enviro,https://www.crunchbase.com/funding_round/alliance-environmental-group-inc-private-equity--38e30657,Alliance-Enviro,https://www.crunchbase.com/organization/alliance-environmental-group-inc,Private Equity,,,,2017-12-22,"Consulting, Information Technology","Azusa, California, United States, North America",$10M to $50M,1,Private Equity
Series A - GraftWorx,https://www.crunchbase.com/funding_round/graftworx-series-a--4e5c8712,GraftWorx,https://www.crunchbase.com/organization/graftworx,Series A,10800000,USD,10800000,2017-12-22,"Health Care, Health Diagnostics, mHealth","Menlo Park, California, United States, North America",Less than $1M,4,Early Stage Venture
Post-IPO Equity - Biotricity,https://www.crunchbase.com/funding_round/biotricity-post-ipo-equity--fdaac97f,Biotricity,https://www.crunchbase.com/organization/biotricity,Post-IPO Equity,2500000,USD,2500000,2017-12-22,"Biometrics, Health Care, Medical Device","Redwood City, California, United States, North America",Less than $1M,2,IPO
Venture Round - Boomtown,https://www.crunchbase.com/funding_round/boomtown-inc-series-unknown--5b4dde68,Boomtown,https://www.crunchbase.com/organization/boomtown-inc,Venture - Series Unknown,1604000,USD,1604000,2017-12-22,"Customer Service, Information Technology, Mobile Apps, Product Design, Software, Technical Support","Belvedere Tiburon, California, United States, North America",$10M to $50M,8,Early Stage Venture
Corporate Round - StockCross Financial Services,https://www.crunchbase.com/funding_round/stockcross-financial-services-corporate-round--f1348b6a,StockCross Financial Services,https://www.crunchbase.com/organization/stockcross-financial-services,Corporate Round,12000000,USD,12000000,2017-12-22,"Customer Service, Financial Services, Online Portals","Beverly Hills, California, United States, North America",$10M to $50M,1,M&A
Debt Financing - Theranos,https://www.crunchbase.com/funding_round/theranos-debt-financing--7cbc3b59,Theranos,https://www.crunchbase.com/organization/theranos,Debt Financing,100000000,USD,100000000,2017-12-23,"Biotechnology, Consumer, Health Care, Health Diagnostics","Palo Alto, California, United States, North America",,10,Private Equity
Series B - NodeSource,https://www.crunchbase.com/funding_round/nodesource-series-b--fd3c1f77,NodeSource,https://www.crunchbase.com/organization/nodesource,Series B,17500000,USD,17500000,2017-12-25,"Application Performance Management, Cloud Infrastructure, Cloud Security, Cyber Security, Enterprise Software, Information Technology, Open Source, Software","San Francisco, California, United States, North America",$10M to $50M,3,Early Stage Venture
Venture Round - ITOCHU Techno Solutions America,https://www.crunchbase.com/funding_round/itochu-technosolutions-america-series-unknown--96826e68,ITOCHU Techno Solutions America,https://www.crunchbase.com/organization/itochu-technosolutions-america,Venture - Series Unknown,5000016,USD,5000016,2017-12-26,"Information Technology, Robotics, Software","Santa Clara, California, United States, North America",$10M to $50M,1,
Series D - Renova Therapeutics,https://www.crunchbase.com/funding_round/renova-therapeutics-series-d--b47934d1,Renova Therapeutics,https://www.crunchbase.com/organization/renova-therapeutics,Series D,,,,2017-12-27,"Biotechnology, Genetics, Health Care","San Diego, California, United States, North America",$10M to $50M,2,Late Stage Venture
Seed Round - Deepcell,https://www.crunchbase.com/funding_round/deepcell-seed--a7b985ec,Deepcell,https://www.crunchbase.com/organization/deepcell,Seed,5000000,USD,5000000,2017-12-27,"Genetics, Health Care","Mountain View, California, United States, North America",$1M to $10M,1,Seed
Series A - DYN365,https://www.crunchbase.com/funding_round/dyn365-series-a--9e737f81,DYN365,https://www.crunchbase.com/organization/dyn365,Series A,20375001,USD,20375001,2017-12-27,"Information Technology, Service Industry","Irvine, California, United States, North America",Less than $1M,3,Late Stage Venture
Venture Round - Neurolens,https://www.crunchbase.com/funding_round/eyebrain-medical-series-unknown--af100887,Neurolens,https://www.crunchbase.com/organization/eyebrain-medical,Venture - Series Unknown,13121905,USD,13121905,2017-12-27,"Eyewear, Health Care, Medical, Medical Device, Neuroscience","Costa Mesa, California, United States, North America",$1M to $10M,4,
Seed Round - Robin Healthcare,https://www.crunchbase.com/funding_round/robin-healthcare-seed--1189c02a,Robin Healthcare,https://www.crunchbase.com/organization/robin-healthcare,Seed,3360000,USD,3360000,2017-12-27,"Health Care, Hospital, Medical","Berkeley, California, United States, North America",Less than $1M,2,Early Stage Venture
Seed Round - Karma Nation,https://www.crunchbase.com/funding_round/karma-nation-seed--8071817e,Karma Nation,https://www.crunchbase.com/organization/karma-nation,Seed,750000,USD,750000,2017-12-28,Information Technology,"San Diego, California, United States, North America",,2,
Seed Round - Orthoscience,https://www.crunchbase.com/funding_round/orthoscience-inc-seed--a43c294d,Orthoscience,https://www.crunchbase.com/organization/orthoscience-inc,Seed,900000,USD,900000,2017-12-28,"Education, Health Care, Social Network","Mill Valley, California, United States, North America",,1,Seed
Venture Round - Therapydia,https://www.crunchbase.com/funding_round/therapydia-series-unknown--c370d6f5,Therapydia,https://www.crunchbase.com/organization/therapydia,Venture - Series Unknown,1075449,USD,1075449,2017-12-29,"Apps, Fitness, Health Care, Personal Health","Mill Valley, California, United States, North America",Less than $1M,6,
Seed Round - CASPIAN,https://www.crunchbase.com/funding_round/caspian-dc20-seed--de91b77f,CASPIAN,https://www.crunchbase.com/organization/caspian-dc20,Seed,,,,2017-12-30,"Asset Management, Cryptocurrency, FinTech","San Francisco, California, United States, North America",Less than $1M,2,
Pre Seed Round - Foresight,https://www.crunchbase.com/funding_round/foresight-mental-health-pre-seed--82088c88,Foresight,https://www.crunchbase.com/organization/foresight-mental-health,Pre-Seed,500000,USD,500000,2017-12-30,"Health Care, Medical","Berkeley, California, United States, North America",$1M to $10M,2,Seed
Seed Round - Bright Funds,https://www.crunchbase.com/funding_round/bright-funds-seed--e5e0fd68,Bright Funds,https://www.crunchbase.com/organization/bright-funds,Seed,,,,2017-12-31,"Financial Services, Internet, Non Profit","San Francisco, California, United States, North America",Less than $1M,7,Seed
Series A - New Incentives,https://www.crunchbase.com/funding_round/new-incentives-series-a--e280a0d8,New Incentives,https://www.crunchbase.com/organization/new-incentives,Series A,6802000,USD,6802000,2017-12-31,"Health Care, Non Profit, Payments","San Francisco, California, United States, North America",$1M to $10M,5,Early Stage Venture
Venture Round - UNYQ,https://www.crunchbase.com/funding_round/unyq-2-series-unknown--3951f303,UNYQ,https://www.crunchbase.com/organization/unyq-2,Venture - Series Unknown,4500000,USD,4500000,2017-12-31,"3D Printing, Big Data, Fashion, Health Care, Internet of Things, Personal Health","San Francisco, California, United States, North America",$1M to $10M,9,Early Stage Venture
Funding Round - Gridspace,https://www.crunchbase.com/funding_round/gridspace-undisclosed--94b0b638,Gridspace,https://www.crunchbase.com/organization/gridspace,Funding Round,4500000,USD,4500000,2017-12-31,"Business Development, Information Technology, Software, Speech Recognition, Telecommunications","San Francisco, California, United States, North America",$1M to $10M,4,
Angel Round - CNote,https://www.crunchbase.com/funding_round/cnote-angel--f0372304,CNote,https://www.crunchbase.com/organization/cnote,Angel,1600000,USD,1600000,2017-12-31,"Finance, Financial Services, Impact Investing","Oakland, California, United States, North America",,2,Seed
Venture Round - Planck Aerosystems,https://www.crunchbase.com/funding_round/planck-aerosystems-series-unknown--ca344e14,Planck Aerosystems,https://www.crunchbase.com/organization/planck-aerosystems,Venture - Series Unknown,4400000,USD,4400000,2017-12-31,"Aerospace, Artificial Intelligence, Automotive, Computer Vision, Drones, Information Technology, Navigation, Robotics","San Diego, California, United States, North America",$1M to $10M,2,
Angel Round - Creosafe,https://www.crunchbase.com/funding_round/creosafe-angel--2199730a,Creosafe,https://www.crunchbase.com/organization/creosafe,Angel,,,,2018-01-01,"Blockchain, FinTech","El Segundo, California, United States, North America",,1,Seed
Venture Round - TeselaGen,https://www.crunchbase.com/funding_round/teselagen-series-unknown--33d11024,TeselaGen,https://www.crunchbase.com/organization/teselagen,Venture - Series Unknown,2000000,USD,2000000,2018-01-01,"Artificial Intelligence, Biotechnology, Genetics, Information Technology, Life Science, Software","San Francisco, California, United States, North America",$1M to $10M,3,
"Seed Round - NewRetirement, Inc",https://www.crunchbase.com/funding_round/newretirement-inc-seed--c7c38b40,"NewRetirement, Inc",https://www.crunchbase.com/organization/newretirement-inc,Seed,2200000,USD,2200000,2018-01-01,"Financial Services, FinTech, InsurTech, Retirement","Mill Valley, California, United States, North America",$1M to $10M,1,Seed
"Seed Round - Brybe, Inc.",https://www.crunchbase.com/funding_round/brybe-inc-seed--5f7616cc,"Brybe, Inc.",https://www.crunchbase.com/organization/brybe-inc,Seed,500000,USD,500000,2018-01-01,"Information Technology, Marketplace, Mobile Apps","Los Angeles, California, United States, North America",,1,Seed
Seed Round - Checkoutify,https://www.crunchbase.com/funding_round/checkoutify-seed--a4c5be94,Checkoutify,https://www.crunchbase.com/organization/checkoutify,Seed,60000,USD,60000,2018-01-01,"E-Commerce, Information Technology, Software","Beverly Hills, California, United States, North America",,1,Seed
Seed Round - BORN,https://www.crunchbase.com/funding_round/born-com-seed--0e77698d,BORN,https://www.crunchbase.com/organization/born-com,Seed,6000000,USD,6000000,2018-01-01,"Beauty, Consumer Goods, Fast-Moving Consumer Goods, Information Technology, Interior Design, Product Design, Retail Technology, Sporting Goods","Los Angeles, California, United States, North America",,1,Seed
Seed Round - Scanwell Health,https://www.crunchbase.com/funding_round/scanwell-health-seed--9fc18e6c,Scanwell Health,https://www.crunchbase.com/organization/scanwell-health,Seed,120000,USD,120000,2018-01-01,"Health Care, Medical, Medical Device, Personal Health","Los Angeles, California, United States, North America",Less than $1M,3,Seed
Non Equity Assistance - Vray,https://www.crunchbase.com/funding_round/vray-non-equity-assistance--69acfb68,Vray,https://www.crunchbase.com/organization/vray,Non-equity Assistance,,,,2018-01-01,"Financial Services, Payments","San Diego, California, United States, North America",,1,
Seed Round - MobiledgeX,https://www.crunchbase.com/funding_round/mobileedgex-seed--1aea8e6f,MobiledgeX,https://www.crunchbase.com/organization/mobileedgex,Seed,,,,2018-01-01,"Human Resources, Information Technology, Internet","San Francisco, California, United States, North America",,1,Seed
Secondary Market - Anaplan,https://www.crunchbase.com/funding_round/anaplan-secondary-market--475a0ea2,Anaplan,https://www.crunchbase.com/organization/anaplan,Secondary Market,,,,2018-01-01,"Enterprise Software, Information Technology, Sales, Software","San Francisco, California, United States, North America",$50M to $100M,10,IPO
Pre Seed Round - Tradespace,https://www.crunchbase.com/funding_round/tradespace-pre-seed--07d686b9,Tradespace,https://www.crunchbase.com/organization/tradespace,Pre-Seed,,,,2018-01-01,"Information Technology, Innovation Management, Intellectual Property, Software","San Francisco, California, United States, North America",,2,Seed
Seed Round - Shipsi,https://www.crunchbase.com/funding_round/shipsi-inc-seed--a4493cf4,Shipsi,https://www.crunchbase.com/organization/shipsi-inc,Seed,,,,2018-01-01,"E-Commerce, Information Services, Information Technology","Venice, California, United States, North America",$1M to $10M,6,Seed
